{
  "$schema": "../schemas/render-recipe.schema.json",
  "id": "minimax-h3-video",
  "name": "H3 原尺寸视频",
  "steps": 20,
  "cfg": 1,
  "sampler": "res_multistep",
  "scheduler": "simple",
  "clip_skip": 1,
  "resolutions": {
    "3:4": {
      "width": 768,
      "height": 1024
    },
    "1:1": {
      "width": 1024,
      "height": 1024
    },
    "4:3": {
      "width": 1024,
      "height": 768
    },
    "2:3": {
      "width": 768,
      "height": 1152
    },
    "9:16": {
      "width": 768,
      "height": 1344
    }
  }
}
