{
  "$schema": "../schemas/render-recipe.schema.json",
  "id": "anima-aesthetic-v1-1-candidate",
  "name": "Anima Aesthetic v1.1 · 候选",
  "resolutions": {
    "2:3": {
      "width": 832,
      "height": 1216
    },
    "3:4": {
      "width": 896,
      "height": 1152
    },
    "9:16": {
      "width": 768,
      "height": 1344
    },
    "4:3": {
      "width": 1152,
      "height": 896
    }
  },
  "steps": 30,
  "cfg": 4,
  "sampler": "euler",
  "scheduler": "simple",
  "clip_skip": 1
}
